{
  "version": "1",
  "id": "3f2b8c1e-5a4d-4e7b-9c2a-1d0e6f8a7b90",
  "impresora": "caja",
  "operaciones": [
    {"tipo": "texto", "valor": "Hola"}
  ],
  "cliente_id": "cli_7Hq2MZp4XwR9",
  "emitido": "2026-10-14T18:30:00Z",
  "expira": "2026-10-14T18:29:00Z",
  "firma": "x03MO1+cilVOmUbV/o3OWyGEQYKfbExTB/bRUrNpZXq61/RpK64eiNHUqYDJY768IRc6hhQCAeYKPpbYZHf4Bg=="
}
