{
  "version": "1",
  "id": "780bf0ea-9a33-4add-86f3-9f4f23000fc4",
  "impresora": "caja",
  "referencia": "PED-000812",
  "operaciones": [
    {"tipo": "texto", "valor": "Pedido en línea #812", "negrita": true},
    {"tipo": "par", "izquierda": "TOTAL", "derecha": "$249.00"},
    {"tipo": "cortar"}
  ]
}
