{
  "version": "1",
  "id": "3f2b8c1e-5a4d-4e7b-9c2a-1d0e6f8a7b90",
  "impresora": "caja",
  "operaciones": [
    {"tipo": "texto", "valor": "Hola"}
  ],
  "cliente_id": "mi-tienda",
  "emitido": "2026-10-14T18:30:00Z",
  "expira": "2026-10-14T18:31:30Z",
  "firma": "B38XT30HMrJPf1MRL/Duxyty5yc+7+kCexXjoA4kIS0QjCz/pQWYSoNpe+qdnju2PlWPFxgfxe7QvmUqA+RGCQ=="
}
